{
  "id": "cedula-catastral",
  "nombre": "Cédula catastral",
  "descripcion": "Documento que identifica un bien inmueble ante la Dirección Nacional de Catastro, con sus características y valores catastrales. Se solicita para compraventas, sucesiones y otros trámites notariales.",
  "organismo": "Dirección Nacional de Catastro (MEF)",
  "categoria": "Vivienda e inmuebles",
  "modalidad": "En línea",
  "palabrasClave": [
    "catastro",
    "cedula catastral",
    "inmueble",
    "padron",
    "propiedad",
    "terreno",
    "valor catastral"
  ],
  "requisitos": [
    "Conocer el número de padrón y departamento del inmueble.",
    "Contar con usuario gub.uy (ID Uruguay) para el trámite en línea."
  ],
  "documentacion": [
    "Cédula de identidad del solicitante.",
    "Número de padrón del inmueble."
  ],
  "pasos": [
    "Ingresar al portal de la Dirección Nacional de Catastro con usuario gub.uy.",
    "Seleccionar el departamento y número de padrón.",
    "Abonar la tasa correspondiente en línea si aplica.",
    "Descargar la cédula catastral emitida."
  ],
  "costo": "Consultar tasas vigentes en el portal de Catastro.",
  "plazoEstimado": "Emisión inmediata para padrones urbanos regularizados.",
  "enlaceOficial": "https://www.gub.uy/tramites/solicitud-cedula-catastral",
  "observaciones": [
    "Para padrones rurales o con situaciones especiales puede requerirse gestión presencial."
  ]
}
