{
  "id": "carne-de-salud",
  "nombre": "Carné de salud básico",
  "descripcion": "Certificado que acredita aptitud básica de salud, requerido para trabajar y para diversos trámites (habilitaciones, manipulación de alimentos, licencia de conducir). Se expide en prestadores de salud habilitados por el MSP.",
  "organismo": "Ministerio de Salud Pública (a través de prestadores habilitados)",
  "categoria": "Salud",
  "modalidad": "Presencial",
  "palabrasClave": [
    "carne de salud",
    "carnet de salud",
    "certificado de salud",
    "aptitud",
    "trabajo",
    "msp"
  ],
  "requisitos": [
    "Cédula de identidad vigente.",
    "Agendarse en un prestador habilitado (mutualista, ASSE o clínica autorizada)."
  ],
  "documentacion": [
    "Cédula de identidad.",
    "Carné de salud anterior si se trata de una renovación.",
    "Carné de vacunas (se controla la vigencia de la antitetánica)."
  ],
  "pasos": [
    "Agendar hora en un prestador habilitado por el MSP.",
    "Concurrir en ayunas si el prestador lo indica.",
    "Realizarse los controles (vista, presión, odontológico, análisis según corresponda).",
    "Retirar el carné emitido."
  ],
  "costo": "Varía según el prestador. En ASSE es gratuito para usuarios del sistema público.",
  "plazoEstimado": "Entrega en el día o dentro de la semana según el prestador.",
  "enlaceOficial": "https://www.gub.uy/tramites/carne-salud-basico",
  "observaciones": [
    "Vigencia general de 2 años (puede variar según edad y condición).",
    "Para manipulación de alimentos se requiere además el carné de manipulador."
  ]
}
