{
  "id": "cedula-identidad",
  "nombre": "Cédula de identidad (obtención y renovación)",
  "descripcion": "Documento de identificación obligatorio para todas las personas que residen en Uruguay. Se tramita ante la Dirección Nacional de Identificación Civil (DNIC) con agenda previa.",
  "organismo": "Dirección Nacional de Identificación Civil (Ministerio del Interior)",
  "categoria": "Identidad y documentos",
  "modalidad": "Mixto",
  "palabrasClave": [
    "cedula",
    "cedula de identidad",
    "documento",
    "identificacion",
    "renovar cedula",
    "sacar cedula",
    "dnic",
    "ci"
  ],
  "requisitos": [
    "Agendarse previamente en línea.",
    "Para primera vez: partida de nacimiento o testimonio de la partida.",
    "Para renovación: cédula anterior (aunque esté vencida)."
  ],
  "documentacion": [
    "Partida de nacimiento (primera vez).",
    "Cédula de identidad anterior (renovación).",
    "Constancia de denuncia policial en caso de hurto o extravío."
  ],
  "pasos": [
    "Agendar día y hora en el sitio de la DNIC (agenda.minterior.gub.uy).",
    "Abonar el timbre correspondiente (puede pagarse en línea o en redes de cobranza).",
    "Concurrir a la oficina el día agendado con la documentación.",
    "Tomarse la fotografía y registrar firma y huellas.",
    "Retirar la cédula en el plazo indicado o recibirla según la modalidad elegida."
  ],
  "costo": "Timbre según tipo de trámite (consultar valores vigentes en la DNIC). Es gratuito para personas en situación de vulnerabilidad acreditada por MIDES.",
  "lugar": {
    "nombre": "Oficinas de la DNIC en todo el país",
    "horario": "Según agenda",
    "contacto": "https://www.gub.uy/ministerio-interior"
  },
  "plazoEstimado": "Entrega en general dentro de los 10 días hábiles.",
  "enlaceOficial": "https://www.gub.uy/tramites/cedula-identidad",
  "observaciones": [
    "La renovación puede iniciarse hasta 6 meses antes del vencimiento.",
    "Existen móviles de la DNIC que recorren localidades del interior."
  ]
}
