{
  "id": "licencia-de-conducir-canelones",
  "nombre": "Licencia de conducir (Canelones) — obtención y renovación",
  "descripcion": "Permiso para conducir vehículos expedido por la Intendencia de Canelones, válido en todo el país (permiso único nacional de conducir). Incluye primera vez, renovación y ampliación de categoría.",
  "organismo": "Intendencia de Canelones",
  "departamento": "Canelones",
  "categoria": "Tránsito y transporte",
  "modalidad": "Mixto",
  "palabrasClave": [
    "licencia",
    "licencia de conducir",
    "libreta de conducir",
    "libreta",
    "permiso de conducir",
    "manejar",
    "renovar libreta",
    "examen de manejo"
  ],
  "requisitos": [
    "Ser mayor de 18 años (16 para categoría G1 con autorización).",
    "Cédula de identidad vigente.",
    "Carné de salud o certificado de aptitud psicofísica vigente.",
    "Para primera vez: aprobar examen teórico y práctico."
  ],
  "documentacion": [
    "Cédula de identidad vigente.",
    "Carné de salud vigente o apto psicofísico.",
    "Licencia anterior en caso de renovación.",
    "Comprobante de pago de la tasa."
  ],
  "pasos": [
    "Agendarse en línea en el sitio de la Intendencia de Canelones.",
    "Abonar la tasa correspondiente.",
    "Rendir examen teórico y práctico (solo primera vez o ampliación).",
    "Concurrir el día agendado para la toma de foto y firma.",
    "Retirar la licencia."
  ],
  "costo": "Según categoría y vigencia. Consultar tasas vigentes en la Intendencia.",
  "lugar": {
    "nombre": "Oficinas de Tránsito de la Intendencia de Canelones y municipios habilitados",
    "horario": "Lunes a viernes de 09:00 a 15:00",
    "contacto": "Tel: 1828"
  },
  "plazoEstimado": "Entrega en el día en la mayoría de los casos.",
  "enlaceOficial": "https://www.imcanelones.gub.uy/tramites/licencia-de-conducir",
  "observaciones": [
    "La renovación puede realizarse en cualquier intendencia adherida al permiso único.",
    "Conducir con la licencia vencida está sujeto a multas."
  ]
}
